<?xml version='1.0' encoding='UTF-8' ?>

<addon id='Magic_Boxes' xmlns="http://icplayer.com" xmlns:xsi="http://www.w3.org/2001/XMLSchema-instance" xsi:schemaLocation="http://icplayer.com ../../tools/addon.xsd">
    <model>
        <property name='Grid' nameLabel="Magic_Boxes_property_grid" type='text' isLocalized="true" />
        <property name='Answers' nameLabel="Magic_Boxes_property_answers" type='text' isLocalized="true" />
        <property name="CheckByWords" displayName="Check By Words" nameLabel="Magic_Boxes_property_check_by_words" type="boolean"/>
        <property name="langAttribute" displayName="Lang attribute" nameLabel="Magic_Boxes_property_lang_attribute" type="string" />
        <property name="speechTexts" displayName="Speech texts" nameLabel="Magic_Boxes_property_speech_texts" type="staticlist">
            <property name="Cell" nameLabel="Magic_Boxes_property_speech_text_cell" type="staticrow">
                <property name="Cell" nameLabel="Magic_Boxes_property_speech_text_cell" type="string"/>
            </property>
            <property name="Selected" nameLabel="Magic_Boxes_property_speech_text_selected" type="staticrow">
                <property name="Selected" nameLabel="Magic_Boxes_property_speech_text_selected" type="string"/>
            </property>
            <property name="Deselected" nameLabel="Magic_Boxes_property_speech_text_deselected" type="staticrow">
                <property name="Deselected" nameLabel="Magic_Boxes_property_speech_text_deselected" type="string"/>
            </property>
            <property name="Correct" nameLabel="Magic_Boxes_property_speech_text_correct" type="staticrow">
                <property name="Correct" nameLabel="Magic_Boxes_property_speech_text_correct" type="string"/>
            </property>
            <property name="Wrong" nameLabel="Magic_Boxes_property_speech_text_wrong" type="staticrow">
                <property name="Wrong" nameLabel="Magic_Boxes_property_speech_text_wrong" type="string"/>
            </property>
        </property>
    </model>
</addon>
