<?xml version='1.0' encoding='UTF-8' ?>

<addon id='MultiAudio' xmlns="http://icplayer.com" xmlns:xsi="http://www.w3.org/2001/XMLSchema-instance" xsi:schemaLocation="http://icplayer.com ../../tools/addon.xsd">
	<model>
		<property name='Files' nameLabel="MultiAudio_property_files" type='list' isDefault="true">
			<property name="ID" nameLabel="MultiAudio_property_id" type="string" />
			<property name="Mp3" nameLabel="MultiAudio_property_mp3" type="audio" />
			<property name="Ogg" nameLabel="MultiAudio_property_ogg" type="audio" />
			<property name="Enable loop" nameLabel="MultiAudio_property_enable_loop" type="boolean" />
			<property name="Text" nameLabel="MultiAudio_property_text" type="html" isLocalized="true" />
		</property>
		<property name="Interface" nameLabel="MultiAudio_property_interface" type="{None, Default controls, Display time, Draggable items}"/>
		<property name="Narration" nameLabel="MultiAudio_property_narration" type="narration" isLocalized="true"/>
		<property name="langAttribute" displayName="Lang attribute" nameLabel="MultiAudio_property_lang_attribute" type="string"/>
		<property name="speechTexts" displayName="Speech texts" nameLabel="MultiAudio_property_property_speech_texts" type="staticlist">

			<property name="Selected" nameLabel="MultiAudio_property_selected" type="staticrow">
				<property name="Selected" nameLabel="MultiAudio_property_selected" type="string"/>
			</property>

			<property name="Deselected" nameLabel="MultiAudio_property_deselected" type="staticrow">
				<property name="Deselected" nameLabel="MultiAudio_property_deselected" type="string"/>
			</property>

			<property name="Empty" nameLabel="MultiAudio_property_empty" type="staticrow">
				<property name="Empty" nameLabel="MultiAudio_property_empty" type="string"/>
			</property>

		</property>
	</model>
</addon>