<?xml version='1.0' encoding='UTF-8' ?>
<addon id='EditableWindow' xmlns="http://icplayer.com" xmlns:xsi="http://www.w3.org/2001/XMLSchema-instance" xsi:schemaLocation="http://icplayer.com ../../tools/addon.xsd">
    <model>
        <property name="title" displayName="Title" nameLabel="EditableWindow_property_title" type="string"/>
        <property name="textEditor" nameLabel="EditableWindow_property_text_editor" type="html" />
        <property name="isTextEditorContent" nameLabel="EditableWindow_property_is_text_editor_content" type="boolean" />
        <property name="headerStyle" displayName="Header style" nameLabel="EditableWindow_property_header_style" type="string"/>
        <property name="fileList" displayName="File List" nameLabel="EditableWindow_property_file_list" type="list">
            <property name="id" displayName="ID" nameLabel="EditableWindow_property_id" type="string"/>
            <property name="file" displayName="File" nameLabel="EditableWindow_property_file" type="file"/>
        </property>
        <property name="index" displayName="Index File" nameLabel="EditableWindow_property_index_file" type="file"/>
        <property name="audio" displayName="Audio File" nameLabel="EditableWindow_property_audio_file" type="file"/>
        <property name="video" displayName="Video File" nameLabel="EditableWindow_property_video_file" type="file"/>
        <property name="editingEnabled" displayName="Editing enabled" nameLabel="EditableWindow_property_editing_enabled" type="boolean" />
        <property name="disableResizeHeight" displayName="Disable resize height" nameLabel="EditableWindow_property_disable_resize_height" type="boolean" />
        <property name="offlineMessage" nameLabel="EditableWindow_property_offline_message" type="text" />
        <property name="speechTexts" displayName="Speech texts" nameLabel="EditableWindow_property_speech_texts" type="staticlist">
            <property name="openFullscreen" nameLabel="EditableWindow_property_openFullscreen" type="staticrow">
                <property name="openFullscreen" nameLabel="EditableWindow_property_openFullscreen" type="string"/>
            </property>
            <property name="closeFullscreen" nameLabel="EditableWindow_property_closeFullscreen" type="staticrow">
                <property name="closeFullscreen" nameLabel="EditableWindow_property_closeFullscreen" type="string"/>
            </property>
            <property name="closeWindow" nameLabel="EditableWindow_property_closeWindow" type="staticrow">
                <property name="closeWindow" nameLabel="EditableWindow_property_closeWindow" type="string"/>
            </property>
            <property name="textTool" nameLabel="EditableWindow_property_textTool" type="staticrow">
                <property name="textTool" nameLabel="EditableWindow_property_textTool" type="string"/>
            </property>
            <property name="highlightSelect" nameLabel="EditableWindow_property_highlightSelect" type="staticrow">
                <property name="highlightSelect" nameLabel="EditableWindow_property_highlightSelect" type="string"/>
            </property>
            <property name="pickAColor" nameLabel="EditableWindow_property_pickAColor" type="staticrow">
                <property name="pickAColor" nameLabel="EditableWindow_property_pickAColor" type="string"/>
            </property>
            <property name="yellow" nameLabel="EditableWindow_property_yellow" type="staticrow">
                <property name="yellow" nameLabel="EditableWindow_property_yellow" type="string"/>
            </property>
            <property name="blue" nameLabel="EditableWindow_property_blue" type="staticrow">
                <property name="blue" nameLabel="EditableWindow_property_blue" type="string"/>
            </property>
            <property name="red" nameLabel="EditableWindow_property_red" type="staticrow">
                <property name="red" nameLabel="EditableWindow_property_red" type="string"/>
            </property>
            <property name="green" nameLabel="EditableWindow_property_green" type="staticrow">
                <property name="green" nameLabel="EditableWindow_property_green" type="string"/>
            </property>
            <property name="white" nameLabel="EditableWindow_property_white" type="staticrow">
                <property name="white" nameLabel="EditableWindow_property_white" type="string"/>
            </property>
            <property name="noColor" nameLabel="EditableWindow_property_noColor" type="staticrow">
                <property name="noColor" nameLabel="EditableWindow_property_noColor" type="string"/>
            </property>
            <property name="reset" nameLabel="EditableWindow_property_reset" type="staticrow">
                <property name="reset" nameLabel="EditableWindow_property_reset" type="string"/>
            </property>
            <property name="image" nameLabel="EditableWindow_property_image" type="staticrow">
                <property name="image" nameLabel="EditableWindow_property_image" type="string"/>
            </property>
            <property name="audio" nameLabel="EditableWindow_property_audio" type="staticrow">
                <property name="audio" nameLabel="EditableWindow_property_audio" type="string"/>
            </property>
            <property name="video" nameLabel="EditableWindow_property_video" type="staticrow">
                <property name="video" nameLabel="EditableWindow_property_video" type="string"/>
            </property>
        </property>
        <property displayName="Lang attribute" name="langAttribute" nameLabel="EditableWindow_property_lang_attribute" type="string"/>
    </model>
</addon>