<?xml version='1.0' encoding='UTF-8' ?>

<addon id='Text_Selection' xmlns="http://icplayer.com" xmlns:xsi="http://www.w3.org/2001/XMLSchema-instance" xsi:schemaLocation="http://icplayer.com ../../tools/addon.xsd">
	<model>
		<property name='Mode' nameLabel="Text_Selection_property_mode" type='{Mark phrases to select, All selectable}'/>
		<property name='Selection type' nameLabel="Text_Selection_property_selection_type" type='{Single select, Multiselect}'/>
		<property name='Text' nameLabel="Text_Selection_property_text" type='html' isLocalized="true" isDefault="true"/>
        <property name='Enable letters selections' nameLabel="Text_Selection_property_enable_letters_selections" type='boolean'/>
        <property name="isNotActivity" displayName="Is Not Activity" nameLabel="Text_Selection_property_is_not_activity" type="boolean" />
		<property name="enableScroll" displayName="Enable scrolling on mobile" nameLabel="Text_Selection_property_enable_scroll" type="boolean" />
		<property name="langAttribute" displayName="Lang attribute" nameLabel="Text_Selection_property_lang_attribute" type="string" />
        <property name="speechTexts" displayName="Speech texts" nameLabel="Text_Selection_property_speech_texts" type="staticlist">

            <property name="selectedSectionStart" nameLabel="Text_Selection_selected_section_start" type="staticrow">
                <property name="selectedSectionStart" nameLabel="Text_Selection_selected_section_start" type="string"/>
            </property>

			<property name="selectedSectionEnd" nameLabel="Text_Selection_selected_section_end" type="staticrow">
                <property name="selectedSectionEnd" nameLabel="Text_Selection_selected_section_end" type="string"/>
            </property>

			<property name="deselected" nameLabel="Text_Selection_deselected" type="staticrow">
                <property name="deselected" nameLabel="Text_Selection_deselected" type="string"/>
            </property>

			<property name="selected" nameLabel="Text_Selection_selected" type="staticrow">
                <property name="selected" nameLabel="Text_Selection_selected" type="string"/>
            </property>

			<property name="wrong" nameLabel="Text_Selection_wrong" type="staticrow">
                <property name="wrong" nameLabel="Text_Selection_wrong" type="string"/>
            </property>

			<property name="correct" nameLabel="Text_Selection_correct" type="staticrow">
                <property name="correct" nameLabel="Text_Selection_correct" type="string"/>
            </property>

            <property name="phrase" nameLabel="Text_Selection_phrase" type="staticrow">
                <property name="phrase" nameLabel="Text_Selection_phrase" type="string"/>
            </property>

			<property name="phraseEnd" nameLabel="Text_Selection_phrase_end" type="staticrow">
                <property name="phraseEnd" nameLabel="Text_Selection_phrase_end" type="string"/>
            </property>
		</property>
	</model>
</addon>