<?xml version='1.0' encoding='UTF-8' ?>

<addon id='Connection' xmlns="http://icplayer.com" xmlns:xsi="http://www.w3.org/2001/XMLSchema-instance" xsi:schemaLocation="http://icplayer.com ../../tools/addon.xsd">
    <model>
        <property name="isNotActivity" displayName="Is not an activity" nameLabel="Connection_property_is_not_activity" type="boolean" />
        <property name='Single connection mode' nameLabel="Connection_property_single_connection_mode" type='boolean'/>
        <property name="Left column" nameLabel="Connection_property_left_column" type="list" isDefault="true">
            <property name="id" nameLabel="Connection_property_id" type="string" />
            <property name="content" nameLabel="Connection_property_content" type="html" isLocalized="true" />
            <property name="connects to" nameLabel="Connection_property_connects_to" type="string" />
            <property name="additional class" nameLabel="Connection_property_additional_class" type="string" />
        </property>
        <property name="Right column" nameLabel="Connection_property_right_column" type="list">
            <property name="id" nameLabel="Connection_property_id" type="string" />
            <property name="content" nameLabel="Connection_property_content" type="html" isLocalized="true" />
            <property name="connects to" nameLabel="Connection_property_connects_to" type="string" />
            <property name="additional class" nameLabel="Connection_property_additional_class" type="string" />
        </property>
        <property name="Columns width" nameLabel="Connection_property_columns_width" type="list">
            <property name="left" nameLabel="Connection_property_left" type="string" />
            <property name="middle" nameLabel="Connection_property_middle" type="string" />
            <property name="right" nameLabel="Connection_property_right" type="string" />
        </property>
        <property name="initialConnections" nameLabel="Connection_property_initial_connection" type="list">
            <property name="from" nameLabel="Connection_property_initial_connection_from" type="string" />
            <property name="to" nameLabel="Connection_property_initial_connection_to" type="string" />
            <property name="isDisabled" nameLabel="Connection_property_initial_connection_is_disabled" type="boolean"/>
        </property>
        <property name="Default connection color" nameLabel="Connection_property_default_connection_color" type="string" />
        <property name="Correct connection color" nameLabel="Connection_property_correct_connection_color" type="string" />
        <property name="disabledConnectionColor" nameLabel="Connection_property_disabled_connection_color" type="string" />
        <property name="Incorrect connection color" nameLabel="Connection_property_incorrect_connection_color" type="string" />
        <property name="Connection thickness" nameLabel="Connection_property_connection_thickness" type="string" />
        <property name="Random order left column" nameLabel="Connection_property_random_order_left_column" type="boolean" />
        <property name="Random order right column" nameLabel="Connection_property_random_order_right_column" type="boolean" />
        <property name="Show answers line color" nameLabel="Connection_property_show_answers_line_color" type="string" />
        <property name="blockWrongAnswers" displayName="Block wrong answers" nameLabel="Connection_property_block_wrong_answers" type="boolean" />
        <property name="removeDraggedElement" displayName="Remove dragged element" nameLabel="Connection_property_remove_dragged_element" type="boolean" />

        <property name="langAttribute" displayName="Lang attribute" nameLabel="Connection_property_lang_attribute" type="string" />
        <property name="speechTexts" displayName="Speech texts" nameLabel="Connection_property_speech_texts" type="staticlist">

            <property name="Connected" nameLabel="Connection_connected" type="staticrow">
                <property name="Connected" nameLabel="Connection_connected" type="string"/>
            </property>

            <property name="Disconnected" nameLabel="Connection_disconnected" type="staticrow">
                <property name="Disconnected" nameLabel="Connection_disconnected" type="string"/>
            </property>

            <property name="ConnectedTo" nameLabel="Connection_connected_to" type="staticrow">
                <property name="Connected to" nameLabel="Connection_connected_to" type="string"/>
            </property>

            <property name="Selected" nameLabel="Connection_selected" type="staticrow">
                <property name="Selected" nameLabel="Connection_selected" type="string"/>
            </property>

            <property name="Deselected" nameLabel="Connection_deselected" type="staticrow">
                <property name="Deselected" nameLabel="Connection_deselected" type="string"/>
            </property>

            <property name="Correct" nameLabel="Connection_correct" type="staticrow">
                <property name="Correct" nameLabel="Connection_correct" type="string"/>
            </property>

            <property name="Wrong" nameLabel="Connection_wrong" type="staticrow">
                <property name="Wrong" nameLabel="Connection_wrong" type="string"/>
            </property>
        </property>
    </model>
</addon>