<?xml version='1.0' encoding='UTF-8' ?>

<addon id='Navigation_Bar' xmlns="http://icplayer.com" xmlns:xsi="http://www.w3.org/2001/XMLSchema-instance" xsi:schemaLocation="http://icplayer.com ../../tools/addon.xsd">
	<model>
		<property name='ShowNextPrevArrows' type='boolean' displayName="Show Next and Prev arrows" nameLabel="Navigation_Bar_property_show_next_prev_arrows"/>
		<property name="HideHomeLastArrows" type="boolean" displayName="Hide Home and Last arrows" nameLabel="Navigation_Bar_property_show_home_last_arrows"/>
		<property name="Numericals" type="{Western Arabic,Eastern Arabic,Perso-Arabic}" nameLabel="Navigation_Bar_property_numericals"/>
        <property displayName="Styles" name="Styles" type="list" nameLabel="Navigation_Bar_property_styles">
            <property name="Pages" type="string" nameLabel="Navigation_Bar_property_pages"/>
            <property name="Class" type="string" nameLabel="Navigation_Bar_property_class"/>
            <property name="Style" type="string" nameLabel="Navigation_Bar_property_style"/>
        </property>
        <property name='AddClassNBPageOK' type='boolean' displayName='Real-time navigationbar-page-ok' nameLabel="Navigation_Bar_property_add_class_nb_page_ok"/>
        <property name='firstPageAsCover' type='boolean' displayName='First page as cover' nameLabel="Navigation_Bar_property_first_page_as_cover"/>
        <property name='lastPageSeparated' type='boolean' displayName='Last page separated' nameLabel="Navigation_Bar_property_last_page_separated"/>
        <property name="speechTexts" displayName="Speech texts" nameLabel="Navigation_Bar_property_speech_texts" type="staticlist">
            <property name="GoToPageNumber" nameLabel="Navigation_Bar_property_go_to_page_number" type="staticrow">
                <property name="GoToPageNumber" nameLabel="Navigation_Bar_property_go_to_page_number" type="string"/>
            </property>
            <property name="NextPage" nameLabel="Navigation_Bar_property_go_to_next_page" type="staticrow">
                <property name="NextPage" nameLabel="Navigation_Bar_property_go_to_next_page" type="string"/>
            </property>
            <property name="PrevPage" nameLabel="Navigation_Bar_property_go_to_prev_page" type="staticrow">
                <property name="PrevPage" nameLabel="Navigation_Bar_property_go_to_prev_page" type="string"/>
            </property>
            <property name="Titled" nameLabel="Navigation_Bar_property_titled" type="staticrow">
                <property name="Titled" nameLabel="Navigation_Bar_property_titled" type="string"/>
            </property>
            <property name="DottedRight" nameLabel="Navigation_Bar_property_show_more" type="staticrow">
                <property name="DottedRight" nameLabel="Navigation_Bar_property_show_more" type="string"/>
            </property>
            <property name="DottedLeft" nameLabel="Navigation_Bar_property_show_prev" type="staticrow">
                <property name="DottedLeft" nameLabel="Navigation_Bar_property_show_prev" type="string"/>
            </property>
            <property name="DisabledPage" nameLabel="Navigation_Bar_property_disabled_page" type="staticrow">
                <property name="DisabledPage" nameLabel="Navigation_Bar_property_disabled_page" type="string"/>
            </property>
        </property>
        <property name="langAttribute" displayName="Lang attribute" nameLabel="Navigation_Bar_property_lang_attribute" type="string" />
        <property name='playTitle' type='boolean' nameLabel="Navigation_Bar_property_play_title"/>
        <property name='blockNotVisited' type='boolean' displayName='Block not visited pages' nameLabel="Navigation_Bar_property_block_not_visited"/>
	</model>
</addon>