<?xml version='1.0' encoding='UTF-8' ?>
<addon id='Text_To_Speech' xmlns="http://icplayer.com" xmlns:xsi="http://www.w3.org/2001/XMLSchema-instance" xsi:schemaLocation="http://icplayer.com ../../tools/addon.xsd">
    <model>
        <property name="configuration" displayName="Configuration" nameLabel="Text_To_Speech_configuration" type="list" isDefault="true">
            <property name="ID" nameLabel="Text_To_Speech_property_id" type="string" />
            <property name="Area" displayName="Area" nameLabel="Text_To_Speech_area" type="{Main, Header, Footer}" />
            <property name="Title" nameLabel="Text_To_Speech_property_title" type="string" isLocalized="true" />
        </property>

        <property name="EnterText" nameLabel="Text_To_Speech_property_enter_text" type="string" isLocalized="true" />
        <property name="ExitText" nameLabel="Text_To_Speech_property_exit_text" type="string" isLocalized="true" />
        <property name="NewPage" nameLabel="Text_To_Speech_property_new_page" type="string" isLocalized="true" />
        <property name="PageLangTag" nameLabel="Text_To_Speech_property_page_lang_tag" type="string" isLocalized="true" />
        <property name="disableNewPageMessage" nameLabel="Text_To_Speech_property_disable_new_page_message" type="boolean"/>
    </model>
</addon>
