<?xml version='1.0' encoding='UTF-8'?>
<addon id="Fractions" xmlns="http://icplayer.com" xmlns:xsi="http://www.w3.org/2001/XMLSchema-instance" xsi:schemaLocation="http://icplayer.com ../../tools/addon.xsd">
	<model>
		<property name="Figure" nameLabel="Fractions_property_figure" type="{---,Rectangular,Circle,Square}"/>
		<property name="RectHorizontal" displayName="Rectangular horizontal parts" nameLabel="Fractions_property_rect_horizontal" type="string" />
		<property name="RectVertical" displayName="Rectangular vertical parts" nameLabel="Fractions_property_rect_vertical" type="string" />
		<property name="CircleParts" displayName="Circle parts" type="string" nameLabel="Fractions_property_circle_parts"/>
		<property name="SquareParts" displayName="Square parts" type="string" nameLabel="Fractions_property_square_parts"/>
		<property name="Correct" displayName="Number of correct parts" nameLabel="Fractions_property_correct" type="string" />
		<property name="selectedParts" displayName="Selected parts" nameLabel="Fractions_property_selected_parts" type="string" />
		<property name="selectionColor" displayName="Selection color" nameLabel="Fractions_property_selection_color" type="string" />
		<property name="emptyColor" displayName="Empty color" nameLabel="Fractions_property_empty_color" type="string" />
		<property name="strokeColor" displayName="Stroke color" nameLabel="Fractions_property_stroke_color" type="string" />
		<property name="strokeWidth" displayName="Stroke width" nameLabel="Fractions_property_stroke_width" type="string" />
		<property name="isNotActivity" nameLabel="Fractions_property_is_not_activity" type="boolean"/>
		<property name="isDisable" nameLabel="Fractions_property_is_disable" type="boolean"/>
        <property name="imageDeselect" displayName="Image for deselected parts" nameLabel="Fractions_property_is_deselect" type="image"/>
        <property name="imageSelect" displayName="Image for selected parts" nameLabel="Fractions_property_is_select" type="image"/>
		<property name="speechTexts" displayName="Speech texts" nameLabel="Fractions_property_speech_texts"
				  type="staticlist">
			<property name="Selected" nameLabel="Fractions_speech_text_selected" type="staticrow">
				<property name="Selected" nameLabel="Fractions_speech_text_selected" type="string"/>
			</property>
			<property name="Deselected" nameLabel="Fractions_speech_text_deselected" type="staticrow">
				<property name="Deselected" nameLabel="Fractions_speech_text_deselected" type="string"/>
			</property>
			<property name="Item" nameLabel="Fractions_speech_text_item" type="staticrow">
				<property name="Item" nameLabel="Fractions_speech_text_item" type="string"/>
			</property>
			<property name="Correct" nameLabel="Fractions_speech_text_correct" type="staticrow">
				<property name="Correct" nameLabel="Fractions_speech_text_correct" type="string"/>
			</property>
			<property name="Wrong" nameLabel="Fractions_speech_text_wrong" type="staticrow">
				<property name="Wrong" nameLabel="Fractions_speech_text_wrong" type="string"/>
			</property>
			<property name="of" nameLabel="Fractions_speech_text_of" type="staticrow">
				<property name="of" nameLabel="Fractions_speech_text_of" type="string"/>
			</property>
		</property>
	</model>
</addon>