<?xml version='1.0' encoding='UTF-8' ?>

<addon id='Image_Viewer_Public' xmlns="http://icplayer.com" xmlns:xsi="http://www.w3.org/2001/XMLSchema-instance" xsi:schemaLocation="http://icplayer.com ../../tools/addon.xsd">
	<model>
		<property name='Image' nameLabel="Image_Viewer_Public_property_image" type='image' />
		<property name="Frames" nameLabel="Image_Viewer_Public_property_frames" type="string" />
		<property name="Frame size" nameLabel="Image_Viewer_Public_property_frame_size" type="{Original, Keep aspect ratio, Stretch}" />
		<property name="Sounds" nameLabel="Image_Viewer_Public_property_sounds" type="list">
			<property name="MP3 sound" nameLabel="Image_Viewer_Public_property_mp3_sound" type="audio" />
			<property name="OGG sound" nameLabel="Image_Viewer_Public_property_ogg_sound" type="audio" />
			<property name="AAC sound" nameLabel="Image_Viewer_Public_property_aac_sound" type="audio" />
		</property>
		<property name="Frame names" nameLabel="Image_Viewer_Public_property_frame_names" type="list">
			<property name="name" nameLabel="Image_Viewer_Public_property_name" type="string" />
			<property name="frame" nameLabel="Image_Viewer_Public_property_frames" type="string" />
		</property>
		<property name="Alternative texts" nameLabel="Image_Viewer_Public_property_alternative_texts" type="list">
			<property name="Alternative text" nameLabel="Image_Viewer_Public_property_alternative_text" type="text" />
			<property name="frame" nameLabel="Image_Viewer_Public_property_frames" type="string" />
		</property>
		<property name="isClickDisabled" nameLabel="Image_Viewer_Public_property_is_click_disabled" type="boolean" />
		<property name="Labels" nameLabel="Image_Viewer_Public_property_labels" type="list">
			<property name="Text" nameLabel="Image_Viewer_Public_property_text" type="string" isLocalized="true" />
			<property name="Top" nameLabel="Image_Viewer_Public_property_top" type="string" />
			<property name="Left" nameLabel="Image_Viewer_Public_property_left" type="string" />
			<property name="Frames" nameLabel="Image_Viewer_Public_property_frames" type="string" />
		</property>
		<property name="Show watermark" nameLabel="Image_Viewer_Public_property_show_watermark" type="boolean" />
		<property name="Watermark color" nameLabel="Image_Viewer_Public_property_watermark_color" type="string" />
		<property name="Watermark opacity" nameLabel="Image_Viewer_Public_property_watermark_opacity" type="string" />
		<property name="Watermark size" nameLabel="Image_Viewer_Public_property_watermark_size" type="string" />
		<property name="Show frame" nameLabel="Image_Viewer_Public_property_show_frame" type="string" />
		<property name="Animation" nameLabel="Image_Viewer_Public_property_animation" type="{None, Linear, Fading}" />
		<property name="Correct frames" nameLabel="Image_Viewer_Public_property_correct_frames" type="string" />
		<property name="Do not reset" nameLabel="Image_Viewer_Public_property_do_not_reset" type="boolean" />
		<property name="Random frame" nameLabel="Image_Viewer_Public_property_random_frame" type="boolean" />
		<property name="Initial frame" nameLabel="Image_Viewer_Public_property_initial_frame" type="string" />
		<property name="Show frame counter" nameLabel="Image_Viewer_Public_property_show_frame_counter" type="boolean" />
		<property name="langAttribute"  nameLabel="Image_Viewer_Public_property_lang_attribute" type="string" />
	</model>
</addon>