<?xml version='1.0' encoding='UTF-8' ?>

<addon id='Slider' xmlns="http://icplayer.com" xmlns:xsi="http://www.w3.org/2001/XMLSchema-instance" xsi:schemaLocation="http://icplayer.com ../../tools/addon.xsd">
	<model>
		<property name='ImageElement' nameLabel="Slider_property_image_element" type='image' />
		<property name="Orientation" nameLabel="Slider_property_orientation" type="{Landscape, Portrait}" />
		<property name="Stepwise" nameLabel="Slider_property_stepwise" type="boolean" />
		<property name="StepsCount" nameLabel="Slider_property_steps_count" type="string" />
		<property name="InitialStep" nameLabel="Slider_property_initial_step" type="string" />
		<property name="onStepChange" nameLabel="Slider_property_on_step_change" type="event" />
		<property name="Block in error checking mode" nameLabel="Slider_property_block_in_error_checking_mode" type="boolean" />
		<property name="Continuous events" nameLabel="Slider_property_continuous_events" type="boolean" />
        <property name="Continuous events steps" nameLabel="Slider_property_continuous_events_steps" type="{Stick, Smooth}" />
		<property name="Alternative texts" nameLabel="Slider_property_alternative_texts" type="list">
			<property name="Alternative text" nameLabel="Slider_property_alternative_text" type="text" />
			<property name="Step number" nameLabel="Slider_property_step_number" type="string" />
		</property>
		<property name="langAttribute" nameLabel="Slider_property_lang_attribute" type="string" />
		<property name="speechTexts" nameLabel="Slider_property_speech_texts" type="staticlist">
			<property name="Step" nameLabel="Slider_property_step" type="staticrow">
				<property name="Step" nameLabel="Slider_property_step" type="string"/>
			</property>
		</property>
	</model>
</addon>